{
  "name": "chip",
  "author": "Raspberry Pi",
  "pins": [
    "VDDH",
    "VDD",
    "GND",
    "SDA",
    "SCL",
    "DNC"
  ],
  "controls": [
    {
      "id": "co2",
      "label": "CO2",
      "type": "range",
      "min": 0,
      "max": 40000,
      "step": 1
    },
    {
      "id": "temperature",
      "label": "Temperature",
      "type": "range",
      "min": -10,
      "max": 60,
      "step": 0.01
    },
    {
      "id": "humidity",
      "label": "Humidity",
      "type": "range",
      "min": 0,
      "max": 100,
      "step": 0.01
    }
  ]
}