{
  "name": "chip",
  "author": "Raspberry Pi",
  "pins": [
    "VDD",
    "DATA",
    "",
    "GND"
  ],
  "controls": [
    {
      "id": "temperature",
      "label": "Temperature",
      "type": "range",
      "min": -40,
      "max": 80,
      "step": 0.01
    },
    {
      "id": "humidity",
      "label": "Humidity",
      "type": "range",
      "min": 0,
      "max": 100,
      "step": 0.01
    }
  ]
}